{"authority_placeholders":{"R2-AUTH-001":null,"R2-AUTH-002":null,"R2-AUTH-004":null},"candidates":[{"assumptions":[{"assumption_id":"assumption.qcp-applicability","dependency_ids":["R3-DEP-003"],"state":"UNRESOLVED"}],"candidate_id":"candidate.incomplete","source_class":"SYNTHETIC_TEST_ONLY","steps":[{"action":"fail_node","parameters":{"id":"Z"},"step_id":"step.01-remove-unrelated-node"}]},{"assumptions":[],"candidate_id":"candidate.invalid","source_class":"SYNTHETIC_TEST_ONLY","steps":[{"action":"rotate_gateway","parameters":{},"step_id":"step.01-unsupported"}]},{"assumptions":[],"candidate_id":"candidate.unsafe-middle","source_class":"SYNTHETIC_TEST_ONLY","steps":[{"action":"fail_node","parameters":{"id":"Z"},"step_id":"step.01-remove-unrelated-node"},{"action":"shut_link","parameters":{"host":"A","interface":"Gi0/1"},"step_id":"step.02-strand-service-flow"},{"action":"fail_node","parameters":{"id":"Y"},"step_id":"step.03-remove-next-hop-owner"}]}],"case_id":"qdp001-fixture:unsafe-middle","product_boundary":{"qcp_001":{"execution_state":"CONTRACT_ONLY","qualification_state":"EXPERIMENTAL"},"release_2":"CLOSED_INCOMPLETE_EXPERIMENTAL_CHECKPOINT","release_3":"DISCOVERY_PLANNING_ONLY","runtime":"PARTIAL_NONPORTABLE_PROTOTYPE"},"prototype_mode":"R3_DISCOVERY_SYNTHETIC_ONLY","requirements":[{"dependency_ids":["R3-DEP-001","R3-DEP-003"],"dst":"10.0.5.50","kind":"PRESERVE_SYNTHETIC_FLOW","owner":"SYNTHETIC_TEST_OWNER","requirement_id":"requirement.preserve-service-flow","src":"10.0.1.1"}],"schema":"atlas.r3-break-this-plan-discovery-input/1","source_class":"SYNTHETIC_TEST_ONLY","synthetic_snapshot":{"interfaces":{"A":{"Gi0/1":{"svi_ip":"10.0.13.1/24"}},"Y":{"Gi0/0":{"svi_ip":"10.0.13.2/24"}},"Z":{"Gi0/0":{"svi_ip":"192.0.2.1/24"}}},"routes":{"A":[{"out_intf":"Vlan1","prefix":"10.0.1.0/24","source":"connected"},{"out_intf":"Gi0/1","prefix":"10.0.13.0/24","source":"connected"},{"next_hop":"10.0.13.2","out_intf":"Gi0/1","prefix":"10.0.5.0/24","source":"static"},{"next_hop":"","out_intf":"Null0","prefix":"0.0.0.0/0","source":"static"}],"Y":[{"out_intf":"Gi0/0","prefix":"10.0.13.0/24","source":"connected"},{"out_intf":"Gi0/2","prefix":"10.0.5.0/24","source":"connected"}],"Z":[{"out_intf":"Gi0/0","prefix":"192.0.2.0/24","source":"connected"}]}},"unresolved_dependency_ids":["R3-DEP-001","R3-DEP-002","R3-DEP-003","R3-DEP-004","R3-DEP-005","R3-DEP-006","R3-DEP-007","R3-DEP-008","R3-DEP-009","R3-DEP-010","R3-DEP-011"]}